{"$schema":"http://json-schema.org/draft-07/schema#","type":"object","additionalProperties":false,"required":["schema_version","ledger_id","status","policy","acknowledgement_rule","schedule","runs","missed_slots","acknowledgements"],"properties":{"schema_version":{"const":1},"ledger_id":{"type":"string"},"status":{"const":"candidate_private_immutable"},"policy":{"type":"string"},"acknowledgement_rule":{"type":"string"},"schedule":{"type":"object","additionalProperties":false,"required":["hour","minute","cadence"],"properties":{"hour":{"type":"integer"},"minute":{"type":"integer"},"cadence":{"type":"string"}}},"runs":{"type":"array","items":{"type":"object"}},"missed_slots":{"type":"array","items":{"type":"object"}},"acknowledgements":{"type":"array","items":{"type":"object"}}}}
