{
  "schema_version": 1,
  "ledger_id": "sf-canonical-collector-run-ledger-v1",
  "status": "candidate_private_immutable",
  "policy": "Append-only. Every attempted run is recorded whether it succeeded or not, and every scheduled slot that passed without a run is recorded as an unobserved gap for the operator to review after the fact. Entries are never edited or removed; corrections are additive.",
  "acknowledgement_rule": "Acknowledgements are appended to the acknowledgements array with who accepted the gap and when; operator_acknowledged on each missed slot is derived from them. Acknowledging records that a human has seen and accepted an unobserved slot. It never creates, infers or backfills an observation, and the day remains a gap in every derived series whether acknowledged or not.",
  "schedule": {
    "hour": 11,
    "minute": 30,
    "cadence": "daily"
  },
  "runs": [
    {
      "run_id": "sf-collection-run-20260809T122554Z",
      "collector_version": null,
      "started_at": "2026-08-09T12:25:54Z",
      "completed_at": "2026-08-09T12:25:54Z",
      "outcome": "completed",
      "performed_by": "orchestrated_session_before_scheduled_collector_existed",
      "targets_attempted": 3,
      "observations_retained": 3,
      "abstentions": 0,
      "abstention_reasons": {},
      "tranche_file": "data/observations/candidate/uk-primary-retail-2026-08-09T122437Z.v1.json",
      "evidence_ledger": null,
      "reconstructed": true,
      "reconstruction_note": "Recorded retrospectively from the tranche this run produced. Attempt counts reflect retained observations only; what else may have been tried is not recoverable."
    },
    {
      "run_id": "sf-collection-run-20260809T234337Z",
      "collector_version": null,
      "started_at": "2026-08-09T23:43:37Z",
      "completed_at": "2026-08-09T23:43:37Z",
      "outcome": "completed",
      "performed_by": "orchestrated_session_before_scheduled_collector_existed",
      "targets_attempted": 3,
      "observations_retained": 3,
      "abstentions": 0,
      "abstention_reasons": {},
      "tranche_file": "data/observations/candidate/uk-primary-retail-2026-08-09T234337Z.v1.json",
      "evidence_ledger": null,
      "reconstructed": true,
      "reconstruction_note": "Recorded retrospectively from the tranche this run produced. Attempt counts reflect retained observations only; what else may have been tried is not recoverable."
    },
    {
      "run_id": "sf-collection-run-20260810T165537Z",
      "collector_version": null,
      "started_at": "2026-08-10T16:55:37Z",
      "completed_at": "2026-08-10T16:55:37Z",
      "outcome": "completed",
      "performed_by": "orchestrated_session_before_scheduled_collector_existed",
      "targets_attempted": 3,
      "observations_retained": 3,
      "abstentions": 0,
      "abstention_reasons": {},
      "tranche_file": "data/observations/candidate/uk-primary-retail-2026-08-10T165537Z.v1.json",
      "evidence_ledger": null,
      "reconstructed": true,
      "reconstruction_note": "Recorded retrospectively from the tranche this run produced. Attempt counts reflect retained observations only; what else may have been tried is not recoverable."
    },
    {
      "run_id": "sf-collection-run-20260812T114904Z",
      "collector_version": 1,
      "started_at": "2026-08-12T11:49:04Z",
      "completed_at": "2026-08-12T11:49:31Z",
      "outcome": "completed",
      "targets_attempted": 8,
      "observations_retained": 4,
      "abstentions": 4,
      "abstention_reasons": {
        "CAPACITY_NOT_VISIBLE": 1,
        "HTTP_403": 3
      },
      "tranche_file": "data/observations/candidate/uk-primary-retail-20260812T114904Z.v1.json",
      "evidence_ledger": "research/evidence/primary-retail-20260812T114904Z/ledger.v1.json"
    },
    {
      "run_id": "sf-collection-run-20260812T124505Z",
      "collector_version": 1,
      "started_at": "2026-08-12T12:45:05Z",
      "completed_at": "2026-08-12T12:47:20Z",
      "outcome": "completed",
      "targets_attempted": 45,
      "observations_retained": 17,
      "abstentions": 28,
      "abstention_reasons": {
        "HTTP_403": 22,
        "MPN_NOT_VISIBLE": 6
      },
      "tranche_file": "data/observations/candidate/uk-primary-retail-20260812T124505Z.v1.json",
      "evidence_ledger": "research/evidence/primary-retail-20260812T124505Z/ledger.v1.json"
    },
    {
      "run_id": "sf-collection-run-20260813T063648Z",
      "collector_version": 1,
      "started_at": "2026-08-13T06:36:48Z",
      "completed_at": "2026-08-13T06:36:48Z",
      "outcome": "completed_with_no_usable_readings",
      "targets_attempted": 0,
      "observations_retained": 0,
      "abstentions": 0,
      "abstention_reasons": {},
      "tranche_file": null,
      "evidence_ledger": null
    },
    {
      "run_id": "sf-collection-run-20260813T124505Z",
      "collector_version": 1,
      "started_at": "2026-08-13T12:45:05Z",
      "completed_at": "2026-08-13T12:47:21Z",
      "outcome": "completed",
      "targets_attempted": 45,
      "observations_retained": 36,
      "abstentions": 9,
      "abstention_reasons": {
        "HTTP_403": 5,
        "UNKNOWN": 2,
        "MPN_NOT_VISIBLE": 2
      },
      "tranche_file": "data/observations/candidate/uk-primary-retail-20260813T124505Z.v1.json",
      "evidence_ledger": "research/evidence/primary-retail-20260813T124505Z/ledger.v1.json"
    },
    {
      "run_id": "sf-collection-run-20260814T124504Z",
      "collector_version": 1,
      "started_at": "2026-08-14T12:45:04Z",
      "completed_at": "2026-08-14T12:47:20Z",
      "outcome": "completed",
      "targets_attempted": 45,
      "observations_retained": 36,
      "abstentions": 9,
      "abstention_reasons": {
        "HTTP_403": 5,
        "UNKNOWN": 2,
        "MPN_NOT_VISIBLE": 2
      },
      "tranche_file": "data/observations/candidate/uk-primary-retail-20260814T124504Z.v1.json",
      "evidence_ledger": "research/evidence/primary-retail-20260814T124504Z/ledger.v1.json"
    },
    {
      "run_id": "sf-collection-run-20260815T124505Z",
      "collector_version": 1,
      "started_at": "2026-08-15T12:45:05Z",
      "completed_at": "2026-08-15T12:47:22Z",
      "outcome": "completed",
      "targets_attempted": 45,
      "observations_retained": 36,
      "abstentions": 9,
      "abstention_reasons": {
        "HTTP_403": 5,
        "UNKNOWN": 2,
        "MPN_NOT_VISIBLE": 2
      },
      "tranche_file": "data/observations/candidate/uk-primary-retail-20260815T124505Z.v1.json",
      "evidence_ledger": "research/evidence/primary-retail-20260815T124505Z/ledger.v1.json"
    },
    {
      "run_id": "sf-collection-run-20260816T124506Z",
      "collector_version": 1,
      "started_at": "2026-08-16T12:45:06Z",
      "completed_at": "2026-08-16T12:47:20Z",
      "outcome": "completed",
      "targets_attempted": 45,
      "observations_retained": 36,
      "abstentions": 9,
      "abstention_reasons": {
        "HTTP_403": 5,
        "UNKNOWN": 2,
        "MPN_NOT_VISIBLE": 2
      },
      "tranche_file": "data/observations/candidate/uk-primary-retail-20260816T124506Z.v1.json",
      "evidence_ledger": "research/evidence/primary-retail-20260816T124506Z/ledger.v1.json"
    },
    {
      "run_id": "sf-collection-run-20260817T103006Z",
      "collector_version": 1,
      "started_at": "2026-08-17T10:30:06Z",
      "completed_at": "2026-08-17T10:32:25Z",
      "outcome": "completed",
      "targets_attempted": 45,
      "observations_retained": 36,
      "abstentions": 9,
      "abstention_reasons": {
        "HTTP_403": 5,
        "UNKNOWN": 2,
        "MPN_NOT_VISIBLE": 2
      },
      "tranche_file": "data/observations/candidate/uk-primary-retail-20260817T103006Z.v1.json",
      "evidence_ledger": "research/evidence/primary-retail-20260817T103006Z/ledger.v1.json",
      "global_integration_audit": "research/audits/uk-primary-retail-global-integration-audit-20260817T103006Z.v1.json"
    },
    {
      "run_id": "sf-collection-run-20260818T103007Z",
      "collector_version": 1,
      "started_at": "2026-08-18T10:30:07Z",
      "completed_at": "2026-08-18T10:32:25Z",
      "outcome": "completed",
      "targets_attempted": 45,
      "observations_retained": 35,
      "abstentions": 10,
      "abstention_reasons": {
        "HTTP_403": 5,
        "UNKNOWN": 2,
        "MPN_NOT_VISIBLE": 3
      },
      "tranche_file": "data/observations/candidate/uk-primary-retail-20260818T103007Z.v1.json",
      "evidence_ledger": "research/evidence/primary-retail-20260818T103007Z/ledger.v1.json",
      "global_integration_audit": "research/audits/uk-primary-retail-global-integration-audit-20260818T103007Z.v1.json"
    },
    {
      "run_id": "sf-collection-run-20260819T103006Z",
      "collector_version": 1,
      "started_at": "2026-08-19T10:30:06Z",
      "completed_at": "2026-08-19T10:32:25Z",
      "outcome": "completed",
      "targets_attempted": 45,
      "observations_retained": 35,
      "abstentions": 10,
      "abstention_reasons": {
        "HTTP_403": 5,
        "UNKNOWN": 2,
        "MPN_NOT_VISIBLE": 3
      },
      "tranche_file": "data/observations/candidate/uk-primary-retail-20260819T103006Z.v1.json",
      "evidence_ledger": "research/evidence/primary-retail-20260819T103006Z/ledger.v1.json",
      "global_integration_audit": "research/audits/uk-primary-retail-global-integration-audit-20260819T103006Z.v1.json"
    },
    {
      "run_id": "sf-collection-run-20260820T103006Z",
      "collector_version": 1,
      "started_at": "2026-08-20T10:30:06Z",
      "completed_at": "2026-08-20T10:32:25Z",
      "outcome": "completed",
      "targets_attempted": 45,
      "observations_retained": 35,
      "abstentions": 10,
      "abstention_reasons": {
        "HTTP_403": 5,
        "UNKNOWN": 2,
        "MPN_NOT_VISIBLE": 3
      },
      "tranche_file": "data/observations/candidate/uk-primary-retail-20260820T103006Z.v1.json",